{
  "$schema": "https://json-schema.org/draft/2020-12/schema",
  "$id": "https://radar.wp.org.nz/schemas/collection.v1.schema.json",
  "title": "WP Core Radar collection.v1",
  "type": "object",
  "additionalProperties": false,
  "required": ["schema", "version", "collection_id", "reference_time", "state", "expected_queries", "query_evidence", "unexpected_artifacts", "ambiguous_artifacts", "warnings", "errors"],
  "properties": {
    "schema": {"const": "collection.v1"},
    "version": {"const": 1},
    "collection_id": {"type": "string", "pattern": "collection-v1-[0-9a-f]{24}"},
    "reference_time": {"type": "string", "minLength": 19},
    "state": {"enum": ["complete", "incomplete", "failed"]},
    "expected_queries": {"type": "array", "items": {"type": "string", "minLength": 1}, "uniqueItems": true},
    "query_evidence": {
      "type": "array",
      "items": {
        "type": "object",
        "additionalProperties": false,
        "required": ["query_slug", "source_identity", "artifact_path", "collected_at", "exists", "valid_csv", "recognized_ticket_id", "row_count", "sha256", "warnings", "errors"],
        "properties": {
          "query_slug": {"type": "string", "minLength": 1},
          "source_identity": {"type": "string", "minLength": 1},
          "artifact_path": {"type": "string", "minLength": 1},
          "source_url": {"type": "string", "minLength": 1},
          "source_receipt_path": {"type": "string", "minLength": 1},
          "acquisition_id": {"type": "string", "pattern": "trac-csv-acquisition-v1-[0-9a-f]{24}"},
          "parsing_version": {"type": "string", "minLength": 1},
          "acquisition_execution": {
            "type": "object",
            "additionalProperties": false,
            "required": ["capability", "requiredProvider", "provider", "host", "unattended", "interactiveCanary", "status", "startedAt", "completedAt", "uploadStatus", "readbackStatus", "nextScheduledAcquisition", "failureReason"],
            "properties": {
              "capability": {"const": "wordpress.trac.raw-acquisition"},
              "requiredProvider": {"const": "thor"},
              "provider": {"type": "string", "minLength": 1},
              "host": {"type": "string", "minLength": 1},
              "unattended": {"type": "boolean"},
              "interactiveCanary": {"type": "boolean"},
              "status": {"enum": ["accepted", "diagnostic-canary", "wrong-host"]},
              "startedAt": {"type": ["string", "null"]},
              "completedAt": {"type": ["string", "null"]},
              "uploadStatus": {"type": "string", "minLength": 1},
              "readbackStatus": {"type": "string", "minLength": 1},
              "nextScheduledAcquisition": {"type": ["string", "null"]},
              "failureReason": {"type": ["string", "null"]}
            }
          },
          "collected_at": {"type": ["string", "null"]},
          "exists": {"type": "boolean"},
          "valid_csv": {"type": "boolean"},
          "recognized_ticket_id": {"type": "boolean"},
          "row_count": {"type": "integer"},
          "sha256": {"type": "string", "pattern": "[0-9a-f]{64}|"},
          "warnings": {"type": "array", "items": {"type": "string"}},
          "errors": {"type": "array", "items": {"type": "string"}}
        }
      }
    },
    "unexpected_artifacts": {"type": "array", "items": {"type": "string"}},
    "ambiguous_artifacts": {
      "type": "array",
      "items": {
        "type": "object", "additionalProperties": false,
        "required": ["query_slug", "artifact_paths"],
        "properties": {
          "query_slug": {"type": "string"},
          "artifact_paths": {"type": "array", "items": {"type": "string"}, "minItems": 2}
        }
      }
    },
    "warnings": {"type": "array", "items": {"type": "string"}},
    "errors": {"type": "array", "items": {"type": "string"}}
  }
}
