{"ambiguous_artifacts":[],"collection_id":"collection-v1-2d1775c3f0c749dd226585e3","errors":[],"expected_queries":["accessibility_has_patch","docs_needs_testing","general_needs_testing","good_first_bugs","media_has_patch"],"query_evidence":[{"acquisition_execution":{"capability":"wordpress.trac.raw-acquisition","completedAt":"2026-10-06T15:38:39Z","failureReason":null,"host":"thor","interactiveCanary":false,"nextScheduledAcquisition":null,"provider":"thor","readbackStatus":"pending-repository-publication","requiredProvider":"thor","startedAt":"2026-10-06T15:38:26.327Z","status":"accepted","unattended":true,"uploadStatus":"pending-repository-publication"},"acquisition_id":"trac-csv-acquisition-v1-e1ec806f83c940ebaad4d1ec","artifact_path":"data/raw/manual/2026-10-06T15-38-26Z/accessibility_has_patch.csv","collected_at":"2026-10-06T15:38:26","errors":[],"exists":true,"parsing_version":"core-trac-csv-parser.v1","query_slug":"accessibility_has_patch","recognized_ticket_id":true,"row_count":0,"sha256":"778557984f640205996c0dfdad88065d770f385ef7b40ca36a737cc241a40edd","source_identity":"accessibility_has_patch","source_receipt_path":"data/raw/manual/2026-10-06T15-38-26Z/accessibility_has_patch.source-receipt.json","source_url":"https://core.trac.wordpress.org/query?status=%21closed&keywords=~accessibility&format=csv&col=id&col=summary&col=status&col=component&col=owner&col=type&col=priority&col=milestone&col=version&col=keywords&col=time&col=changetime&col=comments&col=_comments","valid_csv":true,"warnings":["empty_but_valid"]},{"acquisition_execution":{"capability":"wordpress.trac.raw-acquisition","completedAt":"2026-10-06T15:38:39Z","failureReason":null,"host":"thor","interactiveCanary":false,"nextScheduledAcquisition":null,"provider":"thor","readbackStatus":"pending-repository-publication","requiredProvider":"thor","startedAt":"2026-10-06T15:38:26.327Z","status":"accepted","unattended":true,"uploadStatus":"pending-repository-publication"},"acquisition_id":"trac-csv-acquisition-v1-241cb32f8bad49bf5d33c34c","artifact_path":"data/raw/manual/2026-10-06T15-38-26Z/docs_needs_testing.csv","collected_at":"2026-10-06T15:38:26","errors":[],"exists":true,"parsing_version":"core-trac-csv-parser.v1","query_slug":"docs_needs_testing","recognized_ticket_id":true,"row_count":0,"sha256":"778557984f640205996c0dfdad88065d770f385ef7b40ca36a737cc241a40edd","source_identity":"docs_needs_testing","source_receipt_path":"data/raw/manual/2026-10-06T15-38-26Z/docs_needs_testing.source-receipt.json","source_url":"https://core.trac.wordpress.org/query?status=%21closed&keywords=~documentation&format=csv&col=id&col=summary&col=status&col=component&col=owner&col=type&col=priority&col=milestone&col=version&col=keywords&col=time&col=changetime&col=comments&col=_comments","valid_csv":true,"warnings":["empty_but_valid"]},{"acquisition_execution":{"capability":"wordpress.trac.raw-acquisition","completedAt":"2026-10-06T15:38:40Z","failureReason":null,"host":"thor","interactiveCanary":false,"nextScheduledAcquisition":null,"provider":"thor","readbackStatus":"pending-repository-publication","requiredProvider":"thor","startedAt":"2026-10-06T15:38:26.327Z","status":"accepted","unattended":true,"uploadStatus":"pending-repository-publication"},"acquisition_id":"trac-csv-acquisition-v1-5fa57878c2c2d1bcbf603b91","artifact_path":"data/raw/manual/2026-10-06T15-38-26Z/general_needs_testing.csv","collected_at":"2026-10-06T15:38:26","errors":[],"exists":true,"parsing_version":"core-trac-csv-parser.v1","query_slug":"general_needs_testing","recognized_ticket_id":true,"row_count":264,"sha256":"9dc68f7e144ca085003caa1b9121d35d7db3f37450d635c723d4e7fd3d1b0498","source_identity":"general_needs_testing","source_receipt_path":"data/raw/manual/2026-10-06T15-38-26Z/general_needs_testing.source-receipt.json","source_url":"https://core.trac.wordpress.org/query?status=%21closed&keywords=~testing&format=csv&col=id&col=summary&col=status&col=component&col=owner&col=type&col=priority&col=milestone&col=version&col=keywords&col=time&col=changetime&col=comments&col=_comments","valid_csv":true,"warnings":[]},{"acquisition_execution":{"capability":"wordpress.trac.raw-acquisition","completedAt":"2026-10-06T15:38:40Z","failureReason":null,"host":"thor","interactiveCanary":false,"nextScheduledAcquisition":null,"provider":"thor","readbackStatus":"pending-repository-publication","requiredProvider":"thor","startedAt":"2026-10-06T15:38:26.327Z","status":"accepted","unattended":true,"uploadStatus":"pending-repository-publication"},"acquisition_id":"trac-csv-acquisition-v1-ece4a43e13314d7e1bc5b837","artifact_path":"data/raw/manual/2026-10-06T15-38-26Z/good_first_bugs.csv","collected_at":"2026-10-06T15:38:26","errors":[],"exists":true,"parsing_version":"core-trac-csv-parser.v1","query_slug":"good_first_bugs","recognized_ticket_id":true,"row_count":0,"sha256":"778557984f640205996c0dfdad88065d770f385ef7b40ca36a737cc241a40edd","source_identity":"good_first_bugs","source_receipt_path":"data/raw/manual/2026-10-06T15-38-26Z/good_first_bugs.source-receipt.json","source_url":"https://core.trac.wordpress.org/query?status=%21closed&keywords=~starter&format=csv&col=id&col=summary&col=status&col=component&col=owner&col=type&col=priority&col=milestone&col=version&col=keywords&col=time&col=changetime&col=comments&col=_comments","valid_csv":true,"warnings":["empty_but_valid"]},{"acquisition_execution":{"capability":"wordpress.trac.raw-acquisition","completedAt":"2026-10-06T15:38:38Z","failureReason":null,"host":"thor","interactiveCanary":false,"nextScheduledAcquisition":null,"provider":"thor","readbackStatus":"pending-repository-publication","requiredProvider":"thor","startedAt":"2026-10-06T15:38:26.327Z","status":"accepted","unattended":true,"uploadStatus":"pending-repository-publication"},"acquisition_id":"trac-csv-acquisition-v1-249653ba397966dd2475e84b","artifact_path":"data/raw/manual/2026-10-06T15-38-26Z/media_has_patch.csv","collected_at":"2026-10-06T15:38:26","errors":[],"exists":true,"parsing_version":"core-trac-csv-parser.v1","query_slug":"media_has_patch","recognized_ticket_id":true,"row_count":26,"sha256":"4714485e633a082d32864685ef26fd628fc4f01b3e0c120f70f297522979b368","source_identity":"media_has_patch","source_receipt_path":"data/raw/manual/2026-10-06T15-38-26Z/media_has_patch.source-receipt.json","source_url":"https://core.trac.wordpress.org/query?status=%21closed&keywords=~media&format=csv&col=id&col=summary&col=status&col=component&col=owner&col=type&col=priority&col=milestone&col=version&col=keywords&col=time&col=changetime&col=comments&col=_comments","valid_csv":true,"warnings":[]}],"reference_time":"2026-10-06T15:38:26","schema":"collection.v1","state":"complete","unexpected_artifacts":[],"version":1,"warnings":[]}
