{"ambiguous_artifacts":[],"collection_id":"collection-v1-2f99a1b9b496ffc972c349cd","errors":[],"expected_queries":["accessibility_has_patch","docs_needs_testing","general_needs_testing","good_first_bugs","media_has_patch"],"query_evidence":[{"artifact_path":"data/raw/manual/2026-10-03/accessibility_has_patch.csv","collected_at":"2026-10-03T07:32:23","errors":[],"exists":true,"query_slug":"accessibility_has_patch","recognized_ticket_id":true,"row_count":0,"sha256":"778557984f640205996c0dfdad88065d770f385ef7b40ca36a737cc241a40edd","source_identity":"accessibility_has_patch","valid_csv":true,"warnings":["empty_but_valid"]},{"artifact_path":"data/raw/manual/2026-10-03/docs_needs_testing.csv","collected_at":"2026-10-03T07:32:23","errors":[],"exists":true,"query_slug":"docs_needs_testing","recognized_ticket_id":true,"row_count":0,"sha256":"778557984f640205996c0dfdad88065d770f385ef7b40ca36a737cc241a40edd","source_identity":"docs_needs_testing","valid_csv":true,"warnings":["empty_but_valid"]},{"artifact_path":"data/raw/manual/2026-10-03/general_needs_testing.csv","collected_at":"2026-10-03T07:32:23","errors":[],"exists":true,"query_slug":"general_needs_testing","recognized_ticket_id":true,"row_count":263,"sha256":"9aa765dbf89d17929afc63f2540e889a15cf7024e8083cb9e647de6a9b8fd303","source_identity":"general_needs_testing","valid_csv":true,"warnings":[]},{"artifact_path":"data/raw/manual/2026-10-03/good_first_bugs.csv","collected_at":"2026-10-03T07:32:23","errors":[],"exists":true,"query_slug":"good_first_bugs","recognized_ticket_id":true,"row_count":0,"sha256":"778557984f640205996c0dfdad88065d770f385ef7b40ca36a737cc241a40edd","source_identity":"good_first_bugs","valid_csv":true,"warnings":["empty_but_valid"]},{"artifact_path":"data/raw/manual/2026-10-03/media_has_patch.csv","collected_at":"2026-10-03T07:32:23","errors":[],"exists":true,"query_slug":"media_has_patch","recognized_ticket_id":true,"row_count":26,"sha256":"c9d5d133686ac6a5e243d0e015b3328ed3dd926f5ad0552e99af1ce26f2dbcda","source_identity":"media_has_patch","valid_csv":true,"warnings":[]}],"reference_time":"2026-10-03T07:32:23","schema":"collection.v1","state":"complete","unexpected_artifacts":[],"version":1,"warnings":[]}
